{
  "name": "Accel Market Activity and Capability Standard",
  "version": "0.1.0",
  "status": "development",
  "released_at": "2026-08-03",
  "source_commit": "UNCOMMITTED",
  "record_counts": {
    "aliases": 185,
    "concept-properties": 215,
    "concepts": 599,
    "credentials": 17,
    "decision-factors": 22,
    "decision-templates": 7,
    "governance-profiles": 7,
    "properties": 35,
    "property-values": 19,
    "readiness-rules": 30,
    "relationships": 24,
    "request-families": 10,
    "requirement-bundles": 8,
    "requirement-types": 10,
    "response-sections": 29,
    "response-templates": 7,
    "units": 27
  }
}
